{
  "schema_version": "xcp-research-target-summary-v1",
  "snapshot_id": "001-g2-motion-validation",
  "scenario_id": "movement-left",
  "phase": "validation",
  "scenario_sha256": "d6d27b88600dce0b0e6e0baec9bb6c2a9969064d7822f4ac1f8929fb32653d30",
  "source_trace_sha256": "528de3f6efd8fb5cfe502f1fb801aca484cb38213a338b2b315470fffb863c15",
  "target": {
    "class": "constrained Xbox Series X public-UWP candidate",
    "worker_artifact_sha256": "8e1c6d72fd4182c418a260aa744e8712098aeb86935e3f3c7ee9ebb367f32f41",
    "project_sha256": "63e94f62e49e07b76c843fcb1caea3d670a83bd01d25d9019a83e07f6fbd3ce0",
    "execution_status": "complete_for_scenario",
    "lifecycle_operations": {
      "passed": 14,
      "total": 14
    },
    "lifecycle_receipt_sha256": "28ecc5618d4746f23ef933d63a30cd8d2e31b26acdd9e494c76eb8d033a157bd",
    "observation_evidence_sha256": "1f04db3882e403977a9924be4d3a5fadaea7e6fcf2af1bba138b508a10270657",
    "trace_sha256": "1869502612a7bac6001dc60f03a4f39918a26521a7feae97c501776746ef76b3"
  }
}
